{
  "protocol": {
    "major": 1,
    "minor": 0
  },
  "type": "welcome",
  "messageId": "22222222-2222-4222-8222-222222222222",
  "correlationId": "11111111-1111-4111-8111-111111111111",
  "timestamp": "2026-07-15T12:00:00.100Z",
  "payload": {
    "peerId": "33333333-3333-4333-8333-333333333333",
    "negotiatedVersion": {
      "major": 1,
      "minor": 0
    },
    "acceptedCapabilities": [
      "control.handshake.v1"
    ]
  }
}
